
Artist,Title,Length,

"DJ Chidow","Aisle 10 (Skrew Knows How We Do A Remix)",232

"DJ Chidow","Aisle 10, Moody's Shuffle, Humming The Bassline",300

"DJ Chidow","Chosen One (Tripper's Remix)",278

"DJ Chidow","Cosmic Mic Rockin'",249

"DJ Chidow","Electric Toothbrush (Millennium Remix)",402

"DJ Chidow","Firestarting Lunatic",278

"DJ Chidow","Fly Like a Butterfly (dB Remix)",241

"DJ Chidow","Funky Plucker (Lethal Remix feat UniverSoul Will)",348

"DJ Chidow","Grace and Glory (Revelation Remix)",284

"DJ Chidow","Intermission (Jet Set Radio News)",416

"DJ Chidow","Intro (Dreamcaster)",348

"DJ Chidow","Intro",83

"DJ Chidow","Know Your Chicken, Birthday Cake, Do Watcha Do",241

"DJ Chidow","Koto Stomp (Ill Latch Remix)",208

"DJ Chidow","Let the Skank Kick",345

"DJ Chidow","Outro",256

"DJ Chidow","Rain",340

"DJ Chidow","Recipe for the Perfect Flattop (feat ScrewStache)",292

"DJ Chidow","Set it Off (Crunkcore Remix)",267

"DJ Chidow","Teknopathetic (dB Remix)",291

"DJ Chidow","The Answer (I'm Not a Model)",222

"DJ Chidow","Theme of NiGHTS (Part 1 The Dream)",378

"DJ Chidow","Theme of NiGHTS (Part 2 The Nightmare)",389

"DJ Chidow","What About the JET Future",491
