artist,title,
"Aaron Cox 85",Classical HipHop",
"Beethoven",Fur Elise (Klutch Remix)",
"Broken Circuit",Hitchcock",
"DJ Sth",Classical Music Hip Hop Beat 1",
"DJ Sth",Classical Music Hip Hop Beat 2",
"DJ Sth",Classical Music Hip Hop Beat 3",
"DJ Sth",Classical Music Hip Hop Beat 4",
"German Alejandro Pereira",Classical HipHop",
"Gramatik",Victory",
"Jedi Mind Tricks",Animal Rap (Arituo Gatti Mix) (Instrumental)",
"Josh Vitetti",Lean Back (Street Violin)",
"Lacrimosa",Mozart Trap Remix (Prod.Nightshade Beatz)",
"Redman, Method Man, Def Jam",Symphony 2000",
"RJD2",Cut out the FL",
"RJD2",Run (Instrumental)",
"XIV Beat",APOCALYPSE (MOZART",LACRIMOSA)",
